cnae_name,cnae_formated_code,cnae_category,cnae_code
"AGRICULTURA, PECUÁRIA, PRODUÇÃO FLORESTAL, PESCA E AQUICULTURA",A,section,A
"AGRICULTURA, PECUÁRIA E SERVIÇOS RELACIONADOS",01,division,01
Produção de lavouras temporárias,01.1,group,011
Cultivo de cereais,01.11-3,class,01113
Cultivo de arroz,0111-3/01,subclass,0111301
Cultivo de milho,0111-3/02,subclass,0111302
Cultivo de trigo,0111-3/03,subclass,0111303
Cultivo de outros cereais não especificados anteriormente,0111-3/99,subclass,0111399
Cultivo de algodão herbáceo e de outras fibras de lavoura temporária,01.12-1,class,01121
Cultivo de algodão herbáceo,0112-1/01,subclass,0112101
Cultivo de juta,0112-1/02,subclass,0112102
Cultivo de outras fibras de lavoura temporária não especificadas anteriormente,0112-1/99,subclass,0112199
Cultivo de cana-de-açúcar,01.13-0,class,01130
Cultivo de cana-de-açúcar,0113-0/00,subclass,0113000
Cultivo de fumo,01.14-8,class,01148
Cultivo de fumo,0114-8/00,subclass,0114800
Cultivo de soja,01.15-6,class,01156
Cultivo de soja,0115-6/00,subclass,0115600
"Cultivo de oleaginosas de lavoura temporária, exceto soja",01.16-4,class,01164
Cultivo de amendoim,0116-4/01,subclass,0116401
Cultivo de girassol,0116-4/02,subclass,0116402
Cultivo de mamona,0116-4/03,subclass,0116403
Cultivo de outras oleaginosas de lavoura temporária não especificadas anteriormente,0116-4/99,subclass,0116499
Cultivo de plantas de lavoura temporária não especificadas anteriormente,01.19-9,class,01199
Cultivo de abacaxi,0119-9/01,subclass,0119901
Cultivo de alho,0119-9/02,subclass,0119902
Cultivo de batata-inglesa,0119-9/03,subclass,0119903
Cultivo de cebola,0119-9/04,subclass,0119904
Cultivo de feijão,0119-9/05,subclass,0119905
Cultivo de mandioca,0119-9/06,subclass,0119906
Cultivo de melão,0119-9/07,subclass,0119907
Cultivo de melancia,0119-9/08,subclass,0119908
Cultivo de tomate rasteiro,0119-9/09,subclass,0119909
Cultivo de outras plantas de lavoura temporária não especificadas anteriormente,0119-9/99,subclass,0119999
Horticultura e floricultura,01.2,group,012
Horticultura,01.21-1,class,01211
"Horticultura, exceto morango",0121-1/01,subclass,0121101
Cultivo de morango,0121-1/02,subclass,0121102
Cultivo de flores e plantas ornamentais,01.22-9,class,01229
Cultivo de flores e plantas ornamentais,0122-9/00,subclass,0122900
Produção de lavouras permanentes,01.3,group,013
Cultivo de laranja,01.31-8,class,01318
Cultivo de laranja,0131-8/00,subclass,0131800
Cultivo de uva,01.32-6,class,01326
Cultivo de uva,0132-6/00,subclass,0132600
"Cultivo de frutas de lavoura permanente, exceto laranja e uva",01.33-4,class,01334
Cultivo de açaí,0133-4/01,subclass,0133401
Cultivo de banana,0133-4/02,subclass,0133402
Cultivo de caju,0133-4/03,subclass,0133403
"Cultivo de cítricos, exceto laranja",0133-4/04,subclass,0133404
Cultivo de coco-da-baía,0133-4/05,subclass,0133405
Cultivo de guaraná,0133-4/06,subclass,0133406
Cultivo de maçã,0133-4/07,subclass,0133407
Cultivo de mamão,0133-4/08,subclass,0133408
Cultivo de maracujá,0133-4/09,subclass,0133409
Cultivo de manga,0133-4/10,subclass,0133410
Cultivo de pêssego,0133-4/11,subclass,0133411
Cultivo de frutas de lavoura permanente não especificadas anteriormente,0133-4/99,subclass,0133499
Cultivo de café,01.34-2,class,01342
Cultivo de café,0134-2/00,subclass,0134200
Cultivo de cacau,01.35-1,class,01351
Cultivo de cacau,0135-1/00,subclass,0135100
Cultivo de plantas de lavoura permanente não especificadas anteriormente,01.39-3,class,01393
Cultivo de chá-da-índia,0139-3/01,subclass,0139301
Cultivo de erva-mate,0139-3/02,subclass,0139302
Cultivo de pimenta-do-reino,0139-3/03,subclass,0139303
"Cultivo de plantas para condimento, exceto pimenta-do-reino",0139-3/04,subclass,0139304
Cultivo de dendê,0139-3/05,subclass,0139305
Cultivo de seringueira,0139-3/06,subclass,0139306
Cultivo de outras plantas de lavoura permanente não especificadas anteriormente,0139-3/99,subclass,0139399
Produção de sementes e mudas certificadas,01.4,group,014
Produção de sementes certificadas,01.41-5,class,01415
"Produção de sementes certificadas, exceto de forrageiras para pasto",0141-5/01,subclass,0141501
Produção de sementes certificadas de forrageiras para formação de pasto,0141-5/02,subclass,0141502
"Produção de mudas e outras formas de propagação vegetal, certificadas",01.42-3,class,01423
"Produção de mudas e outras formas de propagação vegetal, certificadas",0142-3/00,subclass,0142300
Pecuária,01.5,group,015
Criação de bovinos,01.51-2,class,01512
Criação de bovinos para corte,0151-2/01,subclass,0151201
Criação de bovinos para leite,0151-2/02,subclass,0151202
"Criação de bovinos, exceto para corte e leite",0151-2/03,subclass,0151203
Criação de outros animais de grande porte,01.52-1,class,01521
Criação de bufalinos,0152-1/01,subclass,0152101
Criação de equinos,0152-1/02,subclass,0152102
Criação de asininos e muares,0152-1/03,subclass,0152103
Criação de caprinos e ovinos,01.53-9,class,01539
Criação de caprinos,0153-9/01,subclass,0153901
"Criação de ovinos, inclusive para produção de lã",0153-9/02,subclass,0153902
Criação de suínos,01.54-7,class,01547
Criação de suínos,0154-7/00,subclass,0154700
Criação de aves,01.55-5,class,01555
Criação de frangos para corte,0155-5/01,subclass,0155501
Produção de pintos de um dia,0155-5/02,subclass,0155502
"Criação de outros galináceos, exceto para corte",0155-5/03,subclass,0155503
"Criação de aves, exceto galináceos",0155-5/04,subclass,0155504
Produção de ovos,0155-5/05,subclass,0155505
Criação de animais não especificados anteriormente,01.59-8,class,01598
Apicultura,0159-8/01,subclass,0159801
Criação de animais de estimação,0159-8/02,subclass,0159802
Criação de escargô,0159-8/03,subclass,0159803
Criação de bicho-da-seda,0159-8/04,subclass,0159804
Criação de outros animais não especificados anteriormente,0159-8/99,subclass,0159899
"Atividades de apoio à agricultura e à pecuária; atividades de
pós-colheita",01.6,group,016
Atividades de apoio à agricultura,01.61-0,class,01610
Serviço de pulverização e controle de pragas agrícolas,0161-0/01,subclass,0161001
Serviço de poda de árvores para lavouras,0161-0/02,subclass,0161002
"Serviço de preparação de terreno, cultivo e colheita",0161-0/03,subclass,0161003
Atividades de apoio à agricultura não especificadas anteriormente,0161-0/99,subclass,0161099
Atividades de apoio à pecuária,01.62-8,class,01628
Serviço de inseminação artificial em animais,0162-8/01,subclass,0162801
Serviço de tosquiamento de ovinos,0162-8/02,subclass,0162802
Serviço de manejo de animais,0162-8/03,subclass,0162803
Atividades de apoio à pecuária não especificadas anteriormente,0162-8/99,subclass,0162899
Atividades de pós-colheita,01.63-6,class,01636
Atividades de pós-colheita,0163-6/00,subclass,0163600
Caça e serviços relacionados,01.7,group,017
Caça e serviços relacionados,01.70-9,class,01709
Caça e serviços relacionados,0170-9/00,subclass,0170900
PRODUÇÃO FLORESTAL,02,division,02
Produção florestal - florestas plantadas,02.1,group,021
Produção florestal - florestas plantadas,02.10-1,class,02101
Cultivo de eucalipto,0210-1/01,subclass,0210101
Cultivo de acácia-negra,0210-1/02,subclass,0210102
Cultivo de pinus,0210-1/03,subclass,0210103
Cultivo de teca,0210-1/04,subclass,0210104
"Cultivo de espécies madeireiras, exceto eucalipto, acácia-negra, pinus e teca",0210-1/05,subclass,0210105
Cultivo de mudas em viveiros florestais,0210-1/06,subclass,0210106
Extração de madeira em florestas plantadas,0210-1/07,subclass,0210107
Produção de carvão vegetal - florestas plantadas,0210-1/08,subclass,0210108
Produção de casca de acácia-negra - florestas plantadas,0210-1/09,subclass,0210109
Produção de produtos não madeireiros não especificados anteriormente em florestas plantadas,0210-1/99,subclass,0210199
Produção florestal - florestas nativas,02.2,group,022
Produção florestal - florestas nativas,02.20-9,class,02209
Extração de madeira em florestas nativas,0220-9/01,subclass,0220901
Produção de carvão vegetal - florestas nativas,0220-9/02,subclass,0220902
Coleta de castanha-do-pará em florestas nativas,0220-9/03,subclass,0220903
Coleta de látex em florestas nativas,0220-9/04,subclass,0220904
Coleta de palmito em florestas nativas,0220-9/05,subclass,0220905
Conservação de florestas nativas,0220-9/06,subclass,0220906
Coleta de produtos não madeireiros não especificados anteriormente em florestas nativas,0220-9/99,subclass,0220999
Atividades de apoio à produção florestal,02.3,group,023
Atividades de apoio à produção florestal,02.30-6,class,02306
Atividades de apoio à produção florestal,0230-6/00,subclass,0230600
PESCA E AQÜICULTURA,03,division,03
Pesca,03.1,group,031
Pesca em água salgada,03.11-6,class,03116
Pesca de peixes em água salgada,0311-6/01,subclass,0311601
Pesca de crustáceos e moluscos em água salgada,0311-6/02,subclass,0311602
Coleta de outros produtos marinhos,0311-6/03,subclass,0311603
Atividades de apoio à pesca em água salgada,0311-6/04,subclass,0311604
Pesca em água doce,03.12-4,class,03124
Pesca de peixes em água doce,0312-4/01,subclass,0312401
Pesca de crustáceos e moluscos em água doce,0312-4/02,subclass,0312402
Coleta de outros produtos aquáticos de água doce,0312-4/03,subclass,0312403
Atividades de apoio à pesca em água doce,0312-4/04,subclass,0312404
Aquicultura,03.2,group,032
Aquicultura em água salgada e salobra,03.21-3,class,03213
Criação de peixes em água salgada e salobra,0321-3/01,subclass,0321301
Criação de camarões em água salgada e salobra,0321-3/02,subclass,0321302
Criação de ostras e mexilhões em água salgada e salobra,0321-3/03,subclass,0321303
Criação de peixes ornamentais em água salgada e salobra,0321-3/04,subclass,0321304
Atividades de apoio à aquicultura em água salgada e salobra,0321-3/05,subclass,0321305
Cultivos e semicultivos da aquicultura em água salgada e salobra não especificados anteriormente,0321-3/99,subclass,0321399
Aquicultura em água doce,03.22-1,class,03221
Criação de peixes em água doce,0322-1/01,subclass,0322101
Criação de camarões em água doce,0322-1/02,subclass,0322102
Criação de ostras e mexilhões em água doce,0322-1/03,subclass,0322103
Criação de peixes ornamentais em água doce,0322-1/04,subclass,0322104
Ranicultura,0322-1/05,subclass,0322105
Criação de jacaré,0322-1/06,subclass,0322106
Atividades de apoio à aquicultura em água doce,0322-1/07,subclass,0322107
Cultivos e semicultivos da aquicultura em água doce não especificados anteriormente,0322-1/99,subclass,0322199
INDÚSTRIAS EXTRATIVAS,B,section,B
EXTRAÇÃO DE CARVÃO MINERAL,05,division,05
Extração de carvão mineral,05.0,group,050
Extração de carvão mineral,05.00-3,class,05003
Extração de carvão mineral,0500-3/01,subclass,0500301
Beneficiamento de carvão mineral,0500-3/02,subclass,0500302
EXTRAÇÃO DE PETRÓLEO E GÁS NATURAL,06,division,06
Extração de petróleo e gás natural,06.0,group,060
Extração de petróleo e gás natural,06.00-0,class,06000
Extração de petróleo e gás natural,0600-0/01,subclass,0600001
Extração e beneficiamento de xisto,0600-0/02,subclass,0600002
Extração e beneficiamento de areias betuminosas,0600-0/03,subclass,0600003
EXTRAÇÃO DE MINERAIS METÁLICOS,07,division,07
Extração de minério de ferro,07.1,group,071
Extração de minério de ferro,07.10-3,class,07103
Extração de minério de ferro,0710-3/01,subclass,0710301
"Pelotização, sinterização e outros beneficiamentos de minério de ferro",0710-3/02,subclass,0710302
Extração de minerais metálicos não ferrosos,07.2,group,072
Extração de minério de alumínio,07.21-9,class,07219
Extração de minério de alumínio,0721-9/01,subclass,0721901
Beneficiamento de minério de alumínio,0721-9/02,subclass,0721902
Extração de minério de estanho,07.22-7,class,07227
Extração de minério de estanho,0722-7/01,subclass,0722701
Beneficiamento de minério de estanho,0722-7/02,subclass,0722702
Extração de minério de manganês,07.23-5,class,07235
Extração de minério de manganês,0723-5/01,subclass,0723501
Beneficiamento de minério de manganês,0723-5/02,subclass,0723502
Extração de minério de metais preciosos,07.24-3,class,07243
Extração de minério de metais preciosos,0724-3/01,subclass,0724301
Beneficiamento de minério de metais preciosos,0724-3/02,subclass,0724302
Extração de minerais radioativos,07.25-1,class,07251
Extração de minerais radioativos,0725-1/00,subclass,0725100
Extração de minerais metálicos não ferrosos não especificados anteriormente,07.29-4,class,07294
Extração de minérios de nióbio e titânio,0729-4/01,subclass,0729401
Extração de minério de tungstênio,0729-4/02,subclass,0729402
Extração de minério de níquel,0729-4/03,subclass,0729403
"Extração de minérios de cobre, chumbo, zinco e outros minerais metálicos não ferrosos não especificados anteriormente",0729-4/04,subclass,0729404
"Beneficiamento de minérios de cobre, chumbo, zinco e outros minerais metálicos não ferrosos não especificados anteriormente",0729-4/05,subclass,0729405
EXTRAÇÃO DE MINERAIS NÃO METÁLICOS,08,division,08
"Extração de pedra, areia e argila",08.1,group,081
"Extração de pedra, areia e argila",08.10-0,class,08100
Extração de ardósia e beneficiamento associado,0810-0/01,subclass,0810001
Extração de granito e beneficiamento associado,0810-0/02,subclass,0810002
Extração de mármore e beneficiamento associado,0810-0/03,subclass,0810003
Extração de calcário e dolomita e beneficiamento associado,0810-0/04,subclass,0810004
Extração de gesso e caulim,0810-0/05,subclass,0810005
"Extração de areia, cascalho ou pedregulho e beneficiamento associado",0810-0/06,subclass,0810006
Extração de argila e beneficiamento associado,0810-0/07,subclass,0810007
Extração de saibro e beneficiamento associado,0810-0/08,subclass,0810008
Extração de basalto e beneficiamento associado,0810-0/09,subclass,0810009
Beneficiamento de gesso e caulim associado à extração,0810-0/10,subclass,0810010
Extração e britamento de pedras e outros materiais para construção e beneficiamento associado,0810-0/99,subclass,0810099
Extração de outros minerais não metálicos,08.9,group,089
"Extração de minerais para fabricação de adubos, fertilizantes e outros produtos químicos",08.91-6,class,08916
"Extração de minerais para fabricação de adubos, fertilizantes e outros produtos químicos",0891-6/00,subclass,0891600
Extração e refino de sal marinho e sal-gema,08.92-4,class,08924
Extração de sal marinho,0892-4/01,subclass,0892401
Extração de sal-gema,0892-4/02,subclass,0892402
Refino e outros tratamentos do sal,0892-4/03,subclass,0892403
Extração de gemas (pedras preciosas e semipreciosas),08.93-2,class,08932
Extração de gemas (pedras preciosas e semipreciosas),0893-2/00,subclass,0893200
Extração de minerais não metálicos não especificados anteriormente,08.99-1,class,08991
Extração de grafita,0899-1/01,subclass,0899101
Extração de quartzo,0899-1/02,subclass,0899102
Extração de amianto,0899-1/03,subclass,0899103
Extração de outros minerais não metálicos não especificados anteriormente,0899-1/99,subclass,0899199
ATIVIDADES DE APOIO À EXTRAÇÃO DE MINERAIS,09,division,09
Atividades de apoio à extração de petróleo e gás natural,09.1,group,091
Atividades de apoio à extração de petróleo e gás natural,09.10-6,class,09106
Atividades de apoio à extração de petróleo e gás natural,0910-6/00,subclass,0910600
"Atividades de apoio à extração de minerais, exceto petróleo e gás natural",09.9,group,099
"Atividades de apoio à extração de minerais, exceto petróleo e gás natural",09.90-4,class,09904
Atividades de apoio à extração de minério de ferro,0990-4/01,subclass,0990401
Atividades de apoio à extração de minerais metálicos não ferrosos,0990-4/02,subclass,0990402
Atividades de apoio à extração de minerais não metálicos,0990-4/03,subclass,0990403
INDÚSTRIAS DE TRANSFORMAÇÃO,C,section,C
FABRICAÇÃO DE PRODUTOS ALIMENTÍCIOS,10,division,10
Abate e fabricação de produtos de carne,10.1,group,101
"Abate de reses, exceto suínos",10.11-2,class,10112
Frigorífico - abate de bovinos,1011-2/01,subclass,1011201
Frigorífico - abate de equinos,1011-2/02,subclass,1011202
Frigorífico - abate de ovinos e caprinos,1011-2/03,subclass,1011203
Frigorífico - abate de bufalinos,1011-2/04,subclass,1011204
"Matadouro - abate de reses sob contrato, exceto abate de suínos",1011-2/05,subclass,1011205
"Abate de suínos, aves e outros pequenos animais",10.12-1,class,10121
Abate de aves,1012-1/01,subclass,1012101
Abate de pequenos animais,1012-1/02,subclass,1012102
Frigorífico - abate de suínos,1012-1/03,subclass,1012103
Matadouro - abate de suínos sob contrato,1012-1/04,subclass,1012104
Fabricação de produtos de carne,10.13-9,class,10139
Fabricação de produtos de carne,1013-9/01,subclass,1013901
Preparação de subprodutos do abate,1013-9/02,subclass,1013902
Preservação do pescado e fabricação de produtos do pescado,10.2,group,102
Preservação do pescado e fabricação de produtos do pescado,10.20-1,class,10201
"Preservação de peixes, crustáceos e moluscos",1020-1/01,subclass,1020101
"Fabricação de conservas de peixes, crustáceos e moluscos",1020-1/02,subclass,1020102
"Fabricação de conservas de frutas, legumes e outros vegetais",10.3,group,103
Fabricação de conservas de frutas,10.31-7,class,10317
Fabricação de conservas de frutas,1031-7/00,subclass,1031700
Fabricação de conservas de legumes e outros vegetais,10.32-5,class,10325
Fabricação de conservas de palmito,1032-5/01,subclass,1032501
"Fabricação de conservas de legumes e outros vegetais, exceto palmito",1032-5/99,subclass,1032599
"Fabricação de sucos de frutas, hortaliças e legumes",10.33-3,class,10333
"Fabricação de sucos concentrados de frutas, hortaliças e legumes",1033-3/01,subclass,1033301
"Fabricação de sucos de frutas, hortaliças e legumes, exceto concentrados",1033-3/02,subclass,1033302
Fabricação de óleos e gorduras vegetais e animais,10.4,group,104
"Fabricação de óleos vegetais em bruto, exceto óleo de milho",10.41-4,class,10414
"Fabricação de óleos vegetais em bruto, exceto óleo de milho",1041-4/00,subclass,1041400
"Fabricação de óleos vegetais refinados, exceto óleo de milho",10.42-2,class,10422
"Fabricação de óleos vegetais refinados, exceto óleo de milho",1042-2/00,subclass,1042200
Fabricação de margarina e outras gorduras vegetais e de óleos não comestíveis de animais,10.43-1,class,10431
Fabricação de margarina e outras gorduras vegetais e de óleos não comestíveis de animais,1043-1/00,subclass,1043100
Laticínios,10.5,group,105
Preparação do leite,10.51-1,class,10511
Preparação do leite,1051-1/00,subclass,1051100
Fabricação de laticínios,10.52-0,class,10520
Fabricação de laticínios,1052-0/00,subclass,1052000
Fabricação de sorvetes e outros gelados comestíveis,10.53-8,class,10538
Fabricação de sorvetes e outros gelados comestíveis,1053-8/00,subclass,1053800
"Moagem, fabricação de produtos amiláceos e de alimentos para animais",10.6,group,106
Beneficiamento de arroz e fabricação de produtos do arroz,10.61-9,class,10619
Beneficiamento de arroz,1061-9/01,subclass,1061901
Fabricação de produtos do arroz,1061-9/02,subclass,1061902
Moagem de trigo e fabricação de derivados,10.62-7,class,10627
Moagem de trigo e fabricação de derivados,1062-7/00,subclass,1062700
Fabricação de farinha de mandioca e derivados,10.63-5,class,10635
Fabricação de farinha de mandioca e derivados,1063-5/00,subclass,1063500
"Fabricação de farinha de milho e derivados, exceto óleos de milho",10.64-3,class,10643
"Fabricação de farinha de milho e derivados, exceto óleos de milho",1064-3/00,subclass,1064300
Fabricação de amidos e féculas de vegetais e de óleos de milho,10.65-1,class,10651
Fabricação de amidos e féculas de vegetais,1065-1/01,subclass,1065101
Fabricação de óleo de milho em bruto,1065-1/02,subclass,1065102
Fabricação de óleo de milho refinado,1065-1/03,subclass,1065103
Fabricação de alimentos para animais,10.66-0,class,10660
Fabricação de alimentos para animais,1066-0/00,subclass,1066000
Moagem e fabricação de produtos de origem vegetal não especificados anteriormente,10.69-4,class,10694
Moagem e fabricação de produtos de origem vegetal não especificados anteriormente,1069-4/00,subclass,1069400
Fabricação e refino de açúcar,10.7,group,107
Fabricação de açúcar em bruto,10.71-6,class,10716
Fabricação de açúcar em bruto,1071-6/00,subclass,1071600
Fabricação de açúcar refinado,10.72-4,class,10724
Fabricação de açúcar de cana refinado,1072-4/01,subclass,1072401
Fabricação de açúcar de cereais (dextrose) e de beterraba,1072-4/02,subclass,1072402
Torrefação e moagem de café,10.8,group,108
Torrefação e moagem de café,10.81-3,class,10813
Beneficiamento de café,1081-3/01,subclass,1081301
Torrefação e moagem de café,1081-3/02,subclass,1081302
Fabricação de produtos à base de café,10.82-1,class,10821
Fabricação de produtos à base de café,1082-1/00,subclass,1082100
Fabricação de outros produtos alimentícios,10.9,group,109
Fabricação de produtos de panificação,10.91-1,class,10911
Fabricação de produtos de panificação industrial,1091-1/01,subclass,1091101
Fabricação de produtos de padaria e confeitaria com predominância de produção própria,1091-1/02,subclass,1091102
Fabricação de biscoitos e bolachas,10.92-9,class,10929
Fabricação de biscoitos e bolachas,1092-9/00,subclass,1092900
"Fabricação de produtos derivados do cacau, de chocolates e confeitos",10.93-7,class,10937
Fabricação de produtos derivados do cacau e de chocolates,1093-7/01,subclass,1093701
"Fabricação de frutas cristalizadas, balas e semelhantes",1093-7/02,subclass,1093702
Fabricação de massas alimentícias,10.94-5,class,10945
Fabricação de massas alimentícias,1094-5/00,subclass,1094500
"Fabricação de especiarias, molhos, temperos e condimentos",10.95-3,class,10953
"Fabricação de especiarias, molhos, temperos e condimentos",1095-3/00,subclass,1095300
Fabricação de alimentos e pratos prontos,10.96-1,class,10961
Fabricação de alimentos e pratos prontos,1096-1/00,subclass,1096100
Fabricação de produtos alimentícios não especificados anteriormente,10.99-6,class,10996
Fabricação de vinagres,1099-6/01,subclass,1099601
Fabricação de pós-alimentícios,1099-6/02,subclass,1099602
Fabricação de fermentos e leveduras,1099-6/03,subclass,1099603
Fabricação de gelo comum,1099-6/04,subclass,1099604
"Fabricação de produtos para infusão (chá, mate, etc.)",1099-6/05,subclass,1099605
Fabricação de adoçantes naturais e artificiais,1099-6/06,subclass,1099606
Fabricação de alimentos dietéticos e complementos alimentares,1099-6/07,subclass,1099607
Fabricação de outros produtos alimentícios não especificados anteriormente,1099-6/99,subclass,1099699
FABRICAÇÃO DE BEBIDAS,11,division,11
Fabricação de bebidas alcoólicas,11.1,group,111
Fabricação de aguardentes e outras bebidas destiladas,11.11-9,class,11119
Fabricação de aguardente de cana-de-açúcar,1111-9/01,subclass,1111901
Fabricação de outras aguardentes e bebidas destiladas,1111-9/02,subclass,1111902
Fabricação de vinho,11.12-7,class,11127
Fabricação de vinho,1112-7/00,subclass,1112700
"Fabricação de malte, cervejas e chopes",11.13-5,class,11135
"Fabricação de malte, inclusive malte uísque",1113-5/01,subclass,1113501
Fabricação de cervejas e chopes,1113-5/02,subclass,1113502
Fabricação de bebidas não alcoólicas,11.2,group,112
Fabricação de águas envasadas,11.21-6,class,11216
Fabricação de águas envasadas,1121-6/00,subclass,1121600
Fabricação de refrigerantes e de outras bebidas não alcoólicas,11.22-4,class,11224
Fabricação de refrigerantes,1122-4/01,subclass,1122401
Fabricação de chá mate e outros chás prontos para consumo,1122-4/02,subclass,1122402
"Fabricação de refrescos, xaropes e pós para refrescos, exceto refrescos de frutas",1122-4/03,subclass,1122403
Fabricação de bebidas isotônicas,1122-4/04,subclass,1122404
Fabricação de outras bebidas não alcoólicas não especificadas anteriormente,1122-4/99,subclass,1122499
FABRICAÇÃO DE PRODUTOS DO FUMO,12,division,12
Processamento industrial do fumo,12.1,group,121
Processamento industrial do fumo,12.10-7,class,12107
Processamento industrial do fumo,1210-7/00,subclass,1210700
Fabricação de produtos do fumo,12.2,group,122
Fabricação de produtos do fumo,12.20-4,class,12204
Fabricação de cigarros,1220-4/01,subclass,1220401
Fabricação de cigarrilhas e charutos,1220-4/02,subclass,1220402
Fabricação de filtros para cigarros,1220-4/03,subclass,1220403
"Fabricação de outros produtos do fumo, exceto cigarros, cigarrilhas e charutos",1220-4/99,subclass,1220499
FABRICAÇÃO DE PRODUTOS TÊXTEIS,13,division,13
Preparação e fiação de fibras têxteis,13.1,group,131
Preparação e fiação de fibras de algodão,13.11-1,class,13111
Preparação e fiação de fibras de algodão,1311-1/00,subclass,1311100
"Preparação e fiação de fibras têxteis naturais, exceto algodão",13.12-0,class,13120
"Preparação e fiação de fibras têxteis naturais, exceto algodão",1312-0/00,subclass,1312000
Fiação de fibras artificiais e sintéticas,13.13-8,class,13138
Fiação de fibras artificiais e sintéticas,1313-8/00,subclass,1313800
Fabricação de linhas para costurar e bordar,13.14-6,class,13146
Fabricação de linhas para costurar e bordar,1314-6/00,subclass,1314600
"Tecelagem, exceto malha",13.2,group,132
Tecelagem de fios de algodão,13.21-9,class,13219
Tecelagem de fios de algodão,1321-9/00,subclass,1321900
"Tecelagem de fios de fibras têxteis naturais, exceto algodão",13.22-7,class,13227
