cnae_name,cnae_formated_code,cnae_category,cnae_code
Transporte marítimo de longo curso - Carga,5012-2/01,subclass,5012201
Transporte marítimo de longo curso - Passageiros,5012-2/02,subclass,5012202
Transporte por navegação interior,50.2,group,502
Transporte por navegação interior de carga,50.21-1,class,50211
"Transporte por navegação interior de carga, municipal, exceto travessia",5021-1/01,subclass,5021101
"Transporte por navegação interior de carga, intermunicipal, interestadual e internacional, exceto travessia",5021-1/02,subclass,5021102
Transporte por navegação interior de passageiros em linhas regulares,50.22-0,class,50220
"Transporte por navegação interior de passageiros em linhas regulares, municipal, exceto travessia",5022-0/01,subclass,5022001
"Transporte por navegação interior de passageiros em linhas regulares, intermunicipal, interestadual e internacional, exceto travessia",5022-0/02,subclass,5022002
Navegação de apoio,50.3,group,503
Navegação de apoio,50.30-1,class,50301
Navegação de apoio marítimo,5030-1/01,subclass,5030101
Navegação de apoio portuário,5030-1/02,subclass,5030102
Serviço de rebocadores e empurradores,5030-1/03,subclass,5030103
Outros transportes aquaviários,50.9,group,509
Transporte por navegação de travessia,50.91-2,class,50912
"Transporte por navegação de travessia, municipal",5091-2/01,subclass,5091201
"Transporte por navegação de travessia, intermunicipal, interestadual e internacional",5091-2/02,subclass,5091202
Transportes aquaviários não especificados anteriormente,50.99-8,class,50998
Transporte aquaviário para passeios turísticos,5099-8/01,subclass,5099801
Outros transportes aquaviários não especificados anteriormente,5099-8/99,subclass,5099899
TRANSPORTE AÉREO,51,division,51
Transporte aéreo de passageiros,51.1,group,511
Transporte aéreo de passageiros regular,51.11-1,class,51111
Transporte aéreo de passageiros regular,5111-1/00,subclass,5111100
Transporte aéreo de passageiros não regular,51.12-9,class,51129
Serviço de táxi aéreo e locação de aeronaves com tripulação,5112-9/01,subclass,5112901
Outros serviços de transporte aéreo de passageiros não regular,5112-9/99,subclass,5112999
Transporte aéreo de carga,51.2,group,512
Transporte aéreo de carga,51.20-0,class,51200
Transporte aéreo de carga,5120-0/00,subclass,5120000
Transporte espacial,51.3,group,513
Transporte espacial,51.30-7,class,51307
Transporte espacial,5130-7/00,subclass,5130700
ARMAZENAMENTO E ATIVIDADES AUXILIARES DOS TRANSPORTES,52,division,52
"Armazenamento, carga e descarga",52.1,group,521
Armazenamento,52.11-7,class,52117
Armazéns gerais - emissão de warrant,5211-7/01,subclass,5211701
Guarda-móveis,5211-7/02,subclass,5211702
"Depósitos de mercadorias para terceiros, exceto armazéns gerais e guarda-móveis",5211-7/99,subclass,5211799
Carga e descarga,52.12-5,class,52125
Carga e descarga,5212-5/00,subclass,5212500
Atividades auxiliares dos transportes terrestres,52.2,group,522
"Concessionárias de rodovias, pontes, túneis e serviços relacionados",52.21-4,class,52214
"Concessionárias de rodovias, pontes, túneis e serviços relacionados",5221-4/00,subclass,5221400
Terminais rodoviários e ferroviários,52.22-2,class,52222
Terminais rodoviários e ferroviários,5222-2/00,subclass,5222200
Estacionamento de veículos,52.23-1,class,52231
Estacionamento de veículos,5223-1/00,subclass,5223100
Atividades auxiliares dos transportes terrestres não especificadas anteriormente,52.29-0,class,52290
"Serviços de apoio ao transporte por táxi, inclusive centrais de chamada",5229-0/01,subclass,5229001
Serviços de reboque de veículos,5229-0/02,subclass,5229002
Outras atividades auxiliares dos transportes terrestres não especificadas anteriormente,5229-0/99,subclass,5229099
Atividades auxiliares dos transportes aquaviários,52.3,group,523
Gestão de portos e terminais,52.31-1,class,52311
Administração da infraestrutura portuária,5231-1/01,subclass,5231101
Atividades do Operador Portuário,5231-1/02,subclass,5231102
Gestão de terminais aquaviários,5231-1/03,subclass,5231103
Atividades de agenciamento marítimo,52.32-0,class,52320
Atividades de agenciamento marítimo,5232-0/00,subclass,5232000
Atividades auxiliares dos transportes aquaviários não especificadas anteriormente,52.39-7,class,52397
Serviços de praticagem,5239-7/01,subclass,5239701
Atividades auxiliares dos transportes aquaviários não especificadas anteriormente,5239-7/99,subclass,5239799
Atividades auxiliares dos transportes aéreos,52.4,group,524
Atividades auxiliares dos transportes aéreos,52.40-1,class,52401
Operação dos aeroportos e campos de aterrissagem,5240-1/01,subclass,5240101
"Atividades auxiliares dos transportes aéreos, exceto operação dos aeroportos e campos de aterrissagem",5240-1/99,subclass,5240199
Atividades relacionadas à organização do transporte de carga,52.5,group,525
Atividades relacionadas à organização do transporte de carga,52.50-8,class,52508
Comissaria de despachos,5250-8/01,subclass,5250801
Atividades de despachantes aduaneiros,5250-8/02,subclass,5250802
"Agenciamento de cargas, exceto para o transporte marítimo",5250-8/03,subclass,5250803
Organização logística do transporte de carga,5250-8/04,subclass,5250804
Operador de transporte multimodal - OTM,5250-8/05,subclass,5250805
CORREIO E OUTRAS ATIVIDADES DE ENTREGA,53,division,53
Atividades de Correio,53.1,group,531
Atividades de Correio,53.10-5,class,53105
Atividades do Correio Nacional,5310-5/01,subclass,5310501
Atividades de franqueadas e permissionárias do Correio Nacional,5310-5/02,subclass,5310502
Atividades de malote e de entrega,53.2,group,532
Atividades de malote e de entrega,53.20-2,class,53202
Serviços de malote não realizados pelo Correio Nacional,5320-2/01,subclass,5320201
Serviços de entrega rápida,5320-2/02,subclass,5320202
ALOJAMENTO E ALIMENTAÇÃO,I,section,I
ALOJAMENTO,55,division,55
Hotéis e similares,55.1,group,551
Hotéis e similares,55.10-8,class,55108
Hotéis,5510-8/01,subclass,5510801
Apart-hotéis,5510-8/02,subclass,5510802
Motéis,5510-8/03,subclass,5510803
Outros tipos de alojamento não especificados anteriormente,55.9,group,559
Outros tipos de alojamento não especificados anteriormente,55.90-6,class,55906
"Albergues, exceto assistenciais",5590-6/01,subclass,5590601
Campings,5590-6/02,subclass,5590602
Pensões (alojamento),5590-6/03,subclass,5590603
Outros alojamentos não especificados anteriormente,5590-6/99,subclass,5590699
ALIMENTAÇÃO,56,division,56
Restaurantes e outros serviços de alimentação e bebidas,56.1,group,561
Restaurantes e outros estabelecimentos de serviços de alimentação e bebidas,56.11-2,class,56112
Restaurantes e similares,5611-2/01,subclass,5611201
"Lanchonetes, casas de chá, de sucos e similares",5611-2/03,subclass,5611203
"Bares e outros estabelecimentos especializados em servir bebidas, sem entretenimento",5611-2/04,subclass,5611204
"Bares e outros estabelecimentos especializados em servir bebidas, com entretenimento",5611-2/05,subclass,5611205
Serviços ambulantes de alimentação,56.12-1,class,56121
Serviços ambulantes de alimentação,5612-1/00,subclass,5612100
"Serviços de catering, bufê e outros serviços de comida preparada",56.2,group,562
"Serviços de catering, bufê e outros serviços de comida preparada",56.20-1,class,56201
Fornecimento de alimentos preparados preponderantemente para empresas,5620-1/01,subclass,5620101
Serviços de alimentação para eventos e recepções - bufê,5620-1/02,subclass,5620102
Cantinas - serviços de alimentação privativos,5620-1/03,subclass,5620103
Fornecimento de alimentos preparados preponderantemente para consumo domiciliar,5620-1/04,subclass,5620104
INFORMAÇÃO E COMUNICAÇÃO,J,section,J
EDIÇÃO E EDIÇÃO INTEGRADA À IMPRESSÃO,58,division,58
"Edição de livros, jornais, revistas e outras atividades de edição",58.1,group,581
Edição de livros,58.11-5,class,58115
Edição de livros,5811-5/00,subclass,5811500
Edição de jornais,58.12-3,class,58123
Edição de jornais diários,5812-3/01,subclass,5812301
Edição de jornais não diários,5812-3/02,subclass,5812302
Edição de revistas,58.13-1,class,58131
Edição de revistas,5813-1/00,subclass,5813100
"Edição de cadastros, listas e outros produtos gráficos",58.19-1,class,58191
"Edição de cadastros, listas e outros produtos gráficos",5819-1/00,subclass,5819100
"Edição integrada à impressão de livros, jornais, revistas e outras publicações",58.2,group,582
Edição integrada à impressão de livros,58.21-2,class,58212
Edição integrada à impressão de livros,5821-2/00,subclass,5821200
Edição integrada à impressão de jornais,58.22-1,class,58221
Edição integrada à impressão de jornais diários,5822-1/01,subclass,5822101
Edição integrada à impressão de jornais não diários,5822-1/02,subclass,5822102
Edição integrada à impressão de revistas,58.23-9,class,58239
Edição integrada à impressão de revistas,5823-9/00,subclass,5823900
"Edição integrada à impressão de cadastros, listas e outros produtos gráficos",58.29-8,class,58298
"Edição integrada à impressão de cadastros, listas e outros produtos gráficos",5829-8/00,subclass,5829800
"ATIVIDADES CINEMATOGRÁFICAS, PRODUÇÃO DE VÍDEOS E DE PROGRAMAS DE TELEVISÃO; GRAVAÇÃO DE SOM E EDIÇÃO DE MÚSICA",59,division,59
"Atividades cinematográficas, produção de vídeos e de programas de televisão",59.1,group,591
"Atividades de produção cinematográfica, de vídeos e de programas de televisão",59.11-1,class,59111
Estúdios cinematográficos,5911-1/01,subclass,5911101
Produção de filmes para publicidade,5911-1/02,subclass,5911102
"Atividades de produção cinematográfica, de vídeos e de programas de televisão não especificadas anteriormente",5911-1/99,subclass,5911199
"Atividades de pós-produção cinematográfica, de vídeos e de programas de televisão",59.12-0,class,59120
Serviços de dublagem,5912-0/01,subclass,5912001
Serviços de mixagem sonora em produção audiovisual,5912-0/02,subclass,5912002
"Atividades de pós-produção cinematográfica, de vídeos e de programas de televisão não especificadas anteriormente",5912-0/99,subclass,5912099
"Distribuição cinematográfica, de vídeo e de programas de televisão",59.13-8,class,59138
"Distribuição cinematográfica, de vídeo e de programas de televisão",5913-8/00,subclass,5913800
Atividades de exibição cinematográfica,59.14-6,class,59146
Atividades de exibição cinematográfica,5914-6/00,subclass,5914600
Atividades de gravação de som e de edição de música,59.2,group,592
Atividades de gravação de som e de edição de música,59.20-1,class,59201
Atividades de gravação de som e de edição de música,5920-1/00,subclass,5920100
ATIVIDADES DE RÁDIO E DE TELEVISÃO,60,division,60
Atividades de rádio,60.1,group,601
Atividades de rádio,60.10-1,class,60101
Atividades de rádio,6010-1/00,subclass,6010100
Atividades de televisão,60.2,group,602
Atividades de televisão aberta,60.21-7,class,60217
Atividades de televisão aberta,6021-7/00,subclass,6021700
Programadoras e atividades relacionadas à televisão por assinatura,60.22-5,class,60225
Programadoras,6022-5/01,subclass,6022501
"Atividades relacionadas à televisão por assinatura, exceto programadoras",6022-5/02,subclass,6022502
TELECOMUNICAÇÕES,61,division,61
Telecomunicações por fio,61.1,group,611
Telecomunicações por fio,61.10-8,class,61108
Serviços de telefonia fixa comutada - STFC,6110-8/01,subclass,6110801
Serviços de redes de transporte de telecomunicações - SRTT,6110-8/02,subclass,6110802
Serviços de comunicação multimídia - SCM,6110-8/03,subclass,6110803
Serviços de telecomunicações por fio não especificados anteriormente,6110-8/99,subclass,6110899
Telecomunicações sem fio,61.2,group,612
Telecomunicações sem fio,61.20-5,class,61205
Telefonia móvel celular,6120-5/01,subclass,6120501
Serviço móvel especializado - SME,6120-5/02,subclass,6120502
Serviços de telecomunicações sem fio não especificados anteriormente,6120-5/99,subclass,6120599
Telecomunicações por satélite,61.3,group,613
Telecomunicações por satélite,61.30-2,class,61302
Telecomunicações por satélite,6130-2/00,subclass,6130200
Operadoras de televisão por assinatura,61.4,group,614
Operadoras de televisão por assinatura por cabo,61.41-8,class,61418
Operadoras de televisão por assinatura por cabo,6141-8/00,subclass,6141800
Operadoras de televisão por assinatura por micro-ondas,61.42-6,class,61426
Operadoras de televisão por assinatura por micro-ondas,6142-6/00,subclass,6142600
Operadoras de televisão por assinatura por satélite,61.43-4,class,61434
Operadoras de televisão por assinatura por satélite,6143-4/00,subclass,6143400
Outras atividades de telecomunicações,61.9,group,619
Outras atividades de telecomunicações,61.90-6,class,61906
Provedores de acesso às redes de comunicações,6190-6/01,subclass,6190601
Provedores de voz sobre protocolo Internet - VOIP,6190-6/02,subclass,6190602
Outras atividades de telecomunicações não especificadas anteriormente,6190-6/99,subclass,6190699
ATIVIDADES DOS SERVIÇOS DE TECNOLOGIA DA INFORMAÇÃO,62,division,62
Atividades dos serviços de tecnologia da informação,62.0,group,620
Desenvolvimento de programas de computador sob encomenda,62.01-5,class,62015
Desenvolvimento de programas de computador sob encomenda,6201-5/01,subclass,6201501
Web desing,6201-5/02,subclass,6201502
Desenvolvimento e licenciamento de programas de computador customizáveis,62.02-3,class,62023
Desenvolvimento e licenciamento de programas de computador customizáveis,6202-3/00,subclass,6202300
Desenvolvimento e licenciamento de programas de computador não customizáveis,62.03-1,class,62031
Desenvolvimento e licenciamento de programas de computador não customizáveis,6203-1/00,subclass,6203100
Consultoria em tecnologia da informação,62.04-0,class,62040
Consultoria em tecnologia da informação,6204-0/00,subclass,6204000
"Suporte técnico, manutenção e outros serviços em tecnologia da informação",62.09-1,class,62091
"Suporte técnico, manutenção e outros serviços em tecnologia da informação",6209-1/00,subclass,6209100
ATIVIDADES DE PRESTAÇÃO DE SERVIÇOS DE INFORMAÇÃO,63,division,63
"Tratamento de dados, hospedagem na Internet e outras atividades relacionadas",63.1,group,631
"Tratamento de dados, provedores de serviços de aplicação e serviços de hospedagem na Internet",63.11-9,class,63119
"Tratamento de dados, provedores de serviços de aplicação e serviços de hospedagem na Internet",6311-9/00,subclass,6311900
"Portais, provedores de conteúdo e outros serviços de informação na Internet",63.19-4,class,63194
"Portais, provedores de conteúdo e outros serviços de informação na Internet",6319-4/00,subclass,6319400
Outras atividades de prestação de serviços de informação,63.9,group,639
Agências de notícias,63.91-7,class,63917
Agências de notícias,6391-7/00,subclass,6391700
Outras atividades de prestação de serviços de informação não especificadas anteriormente,63.99-2,class,63992
Outras atividades de prestação de serviços de informação não especificadas anteriormente,6399-2/00,subclass,6399200
"ATIVIDADES FINANCEIRAS, DE SEGUROS E SERVIÇOS RELACIONADOS",K,section,K
ATIVIDADES DE SERVIÇOS FINANCEIROS,64,division,64
Banco Central,64.1,group,641
Banco Central,64.10-7,class,64107
Banco Central,6410-7/00,subclass,6410700
Intermediação monetária - depósitos à vista,64.2,group,642
Bancos comerciais,64.21-2,class,64212
Bancos comerciais,6421-2/00,subclass,6421200
"Bancos múltiplos, com carteira comercial",64.22-1,class,64221
"Bancos múltiplos, com carteira comercial",6422-1/00,subclass,6422100
Caixas econômicas,64.23-9,class,64239
Caixas econômicas,6423-9/00,subclass,6423900
Crédito cooperativo,64.24-7,class,64247
Bancos cooperativos,6424-7/01,subclass,6424701
Cooperativas centrais de crédito,6424-7/02,subclass,6424702
Cooperativas de crédito mútuo,6424-7/03,subclass,6424703
Cooperativas de crédito rural,6424-7/04,subclass,6424704
Intermediação não monetária - outros instrumentos de captação,64.3,group,643
"Bancos múltiplos, sem carteira comercial",64.31-0,class,64310
"Bancos múltiplos, sem carteira comercial",6431-0/00,subclass,6431000
Bancos de investimento,64.32-8,class,64328
Bancos de investimento,6432-8/00,subclass,6432800
Bancos de desenvolvimento,64.33-6,class,64336
Bancos de desenvolvimento,6433-6/00,subclass,6433600
Agências de fomento,64.34-4,class,64344
Agências de fomento,6434-4/00,subclass,6434400
Crédito imobiliário,64.35-2,class,64352
Sociedades de crédito imobiliário,6435-2/01,subclass,6435201
Associações de poupança e empréstimo,6435-2/02,subclass,6435202
Companhias hipotecárias,6435-2/03,subclass,6435203
"Sociedades de crédito, financiamento e investimento - financeiras",64.36-1,class,64361
"Sociedades de crédito, financiamento e investimento - financeiras",6436-1/00,subclass,6436100
Sociedades de crédito ao microempreendedor,64.37-9,class,64379
Sociedades de crédito ao microempreendedor,6437-9/00,subclass,6437900
Bancos de câmbio e outras instituições de intermediação não monetária,64.38-7,class,64387
Bancos de câmbio,6438-7/01,subclass,6438701
Outras instituições de intermediação não monetária não especificadas anteriormente,6438-7/99,subclass,6438799
Arrendamento mercantil,64.4,group,644
Arrendamento mercantil,64.40-9,class,64409
Arrendamento mercantil,6440-9/00,subclass,6440900
Sociedades de capitalização,64.5,group,645
Sociedades de capitalização,64.50-6,class,64506
Sociedades de capitalização,6450-6/00,subclass,6450600
Atividades de sociedades de participação,64.6,group,646
Holdings de instituições financeiras,64.61-1,class,64611
Holdings de instituições financeiras,6461-1/00,subclass,6461100
Holdings de instituições não financeiras,64.62-0,class,64620
Holdings de instituições não financeiras,6462-0/00,subclass,6462000
"Outras sociedades de participação, exceto holdings",64.63-8,class,64638
"Outras sociedades de participação, exceto holdings",6463-8/00,subclass,6463800
Fundos de investimento,64.7,group,647
Fundos de investimento,64.70-1,class,64701
"Fundos de investimento, exceto previdenciários e imobiliários",6470-1/01,subclass,6470101
Fundos de investimento previdenciários,6470-1/02,subclass,6470102
Fundos de investimento imobiliários,6470-1/03,subclass,6470103
Atividades de serviços financeiros não especificadas anteriormente,64.9,group,649
Sociedades de fomento mercantil - factoring,64.91-3,class,64913
Sociedades de fomento mercantil - factoring,6491-3/00,subclass,6491300
Securitização de créditos,64.92-1,class,64921
Securitização de créditos,6492-1/00,subclass,6492100
Administração de consórcios para aquisição de bens e direitos,64.93-0,class,64930
Administração de consórcios para aquisição de bens e direitos,6493-0/00,subclass,6493000
Outras atividades de serviços financeiros não especificadas anteriormente,64.99-9,class,64999
Clubes de investimento,6499-9/01,subclass,6499901
Sociedades de investimento,6499-9/02,subclass,6499902
Fundo garantidor de crédito,6499-9/03,subclass,6499903
Caixas de financiamento de corporações,6499-9/04,subclass,6499904
Concessão de crédito pelas OSCIP,6499-9/05,subclass,6499905
Outras atividades de serviços financeiros não especificadas anteriormente,6499-9/99,subclass,6499999
"SEGUROS, RESSEGUROS, PREVIDÊNCIA COMPLEMENTAR E PLANOS DE SAÚDE",65,division,65
Seguros de vida e não vida,65.1,group,651
Seguros de vida,65.11-1,class,65111
Sociedade seguradora de seguros vida,6511-1/01,subclass,6511101
Planos de auxílio-funeral,6511-1/02,subclass,6511102
Seguros não vida,65.12-0,class,65120
Sociedade seguradora de seguros não vida,6512-0/00,subclass,6512000
Seguros-saúde,65.2,group,652
Seguros-saúde,65.20-1,class,65201
Sociedade seguradora de seguros-saúde,6520-1/00,subclass,6520100
Resseguros,65.3,group,653
Resseguros,65.30-8,class,65308
Resseguros,6530-8/00,subclass,6530800
Previdência complementar,65.4,group,654
Previdência complementar fechada,65.41-3,class,65413
Previdência complementar fechada,6541-3/00,subclass,6541300
Previdência complementar aberta,65.42-1,class,65421
Previdência complementar aberta,6542-1/00,subclass,6542100
Planos de saúde,65.5,group,655
Planos de saúde,65.50-2,class,65502
Planos de saúde,6550-2/00,subclass,6550200
"ATIVIDADES AUXILIARES DOS SERVIÇOS FINANCEIROS, SEGUROS, PREVIDÊNCIA COMPLEMENTAR E PLANOS DE SAÚDE",66,division,66
Atividades auxiliares dos serviços financeiros,66.1,group,661
Administração de bolsas e mercados de balcão organizados,66.11-8,class,66118
Bolsa de valores,6611-8/01,subclass,6611801
Bolsa de mercadorias,6611-8/02,subclass,6611802
Bolsa de mercadorias e futuros,6611-8/03,subclass,6611803
Administração de mercados de balcão organizados,6611-8/04,subclass,6611804
"Atividades de intermediários em transações de títulos, valores mobiliários e mercadorias",66.12-6,class,66126
Corretoras de títulos e valores mobiliários,6612-6/01,subclass,6612601
Distribuidoras de títulos e valores mobiliários,6612-6/02,subclass,6612602
Corretoras de câmbio,6612-6/03,subclass,6612603
Corretoras de contratos de mercadorias,6612-6/04,subclass,6612604
Agentes de investimentos em aplicações financeiras,6612-6/05,subclass,6612605
Administração de cartões de crédito,66.13-4,class,66134
Administração de cartões de crédito,6613-4/00,subclass,6613400
Atividades auxiliares dos serviços financeiros não especificadas anteriormente,66.19-3,class,66193
Serviços de liquidação e custódia,6619-3/01,subclass,6619301
Correspondentes de instituições financeiras,6619-3/02,subclass,6619302
Representações de bancos estrangeiros,6619-3/03,subclass,6619303
Caixas eletrônicos,6619-3/04,subclass,6619304
Operadoras de cartões de débito,6619-3/05,subclass,6619305
Outras atividades auxiliares dos serviços financeiros não especificadas anteriormente,6619-3/99,subclass,6619399
"Atividades auxiliares dos seguros, da previdência complementar e dos planos de saúde",66.2,group,662
Avaliação de riscos e perdas,66.21-5,class,66215
Peritos e avaliadores de seguros,6621-5/01,subclass,6621501
Auditoria e consultoria atuarial,6621-5/02,subclass,6621502
"Corretores e agentes de seguros, de planos de previdência complementar e de saúde",66.22-3,class,66223
"Corretores e agentes de seguros, de planos de previdência complementar e de saúde",6622-3/00,subclass,6622300
"Atividades auxiliares dos seguros, da previdência complementar e dos planos de saúde não especificadas anteriormente",66.29-1,class,66291
"Atividades auxiliares dos seguros, da previdência complementar e dos planos de saúde não especificadas anteriormente",6629-1/00,subclass,6629100
"Atividades de administração de fundos por contrato ou
comissão",66.3,group,663
"Atividades de administração de fundos por contrato ou
comissão",66.30-4,class,66304
Atividades de administração de fundos por contrato ou comissão,6630-4/00,subclass,6630400
ATIVIDADES IMOBILIÁRIAS,L,section,L
ATIVIDADES IMOBILIÁRIAS,68,division,68
Atividades imobiliárias de imóveis próprios,68.1,group,681
Atividades imobiliárias de imóveis próprios,68.10-2,class,68102
Compra e venda de imóveis próprios,6810-2/01,subclass,6810201
Aluguel de imóveis próprios,6810-2/02,subclass,6810202
Loteamento de imóveis próprios,6810-2/03,subclass,6810203
Atividades imobiliárias por contrato ou comissão,68.2,group,682
"Intermediação na compra, venda e aluguel de imóveis",68.21-8,class,68218
Corretagem na compra e venda e avaliação de imóveis,6821-8/01,subclass,6821801
Corretagem no aluguel de imóveis,6821-8/02,subclass,6821802
Gestão e administração da propriedade imobiliária,68.22-6,class,68226
Gestão e administração da propriedade imobiliária,6822-6/00,subclass,6822600
"ATIVIDADES PROFISSIONAIS, CIENTÍFICAS E TÉCNICAS",M,section,M
"ATIVIDADES JURÍDICAS, DE CONTABILIDADE E DE AUDITORIA",69,division,69
Atividades jurídicas,69.1,group,691
"Atividades jurídicas, exceto cartórios",69.11-7,class,69117
Serviços advocatícios,6911-7/01,subclass,6911701
Atividades auxiliares da justiça,6911-7/02,subclass,6911702
Agente de propriedade industrial,6911-7/03,subclass,6911703
Cartórios,69.12-5,class,69125
Cartórios,6912-5/00,subclass,6912500
"Atividades de contabilidade, consultoria e auditoria contábil e tributária",69.2,group,692
"Atividades de contabilidade, consultoria e auditoria contábil e tributária",69.20-6,class,69206
Atividades de contabilidade,6920-6/01,subclass,6920601
Atividades de consultoria e auditoria contábil e tributária,6920-6/02,subclass,6920602
ATIVIDADES DE SEDES DE EMPRESAS E DE CONSULTORIA EM GESTÃO EMPRESARIAL,70,division,70
Sedes de empresas e unidades administrativas locais,70.1,group,701
Sedes de empresas e unidades administrativas locais,70.10-7,class,70107
Atividades de consultoria em gestão empresarial,70.2,group,702
Atividades de consultoria em gestão empresarial,70.20-4,class,70204
"Atividades de consultoria em gestão empresarial, exceto consultoria técnica específica",7020-4/00,subclass,7020400
SERVIÇOS DE ARQUITETURA E ENGENHARIA; TESTES E ANÁLISES TÉCNICAS,71,division,71
Serviços de arquitetura e engenharia e atividades técnicas relacionadas,71.1,group,711
Serviços de arquitetura,71.11-1,class,71111
Serviços de arquitetura,7111-1/00,subclass,7111100
Serviços de engenharia,71.12-0,class,71120
Serviços de engenharia,7112-0/00,subclass,7112000
Atividades técnicas relacionadas à arquitetura e engenharia,71.19-7,class,71197
"Serviços de cartografia, topografia e geodésia",7119-7/01,subclass,7119701
Atividades de estudos geológicos,7119-7/02,subclass,7119702
Serviços de desenho técnico relacionados à arquitetura e engenharia,7119-7/03,subclass,7119703
